{
  "type": "row",
  "at": "2030-01-07T12:21:00Z",
  "seq": 21,
  "data": {
    "id": "WO-2001",
    "alias": null,
    "goal": "Example: show a sunrise colour in the sky of the demo scene",
    "stream": "DEMO",
    "owner": "crew",
    "plan": "plans/example-plan.md#slice-2",
    "decision": "D-8",
    "repo": "example-owner/example-repo",
    "branch": "wo/2001-sunrise",
    "base": "main",
    "pr": "example#41",
    "stackParent": null,
    "stage": "review",
    "state": "moving",
    "blockedOn": null,
    "next": "Verifier review of head a1b2c3d.",
    "ageH": 26.1,
    "stageAgeH": 3,
    "attempts": 1,
    "dod": {
      "change-note": "no",
      "tests": "yes",
      "names": "yes",
      "glossary": "n/a",
      "docs": "no",
      "map": "no"
    },
    "brief": "work/WO-2001/BRIEF.md",
    "report": null,
    "proof": null,
    "lastSeq": 9
  }
}
