{
  "type": "card",
  "at": "2030-01-07T12:19:00Z",
  "seq": 19,
  "data": {
    "decision": {
      "v": "1.0",
      "id": "D-2",
      "wo": "WO-2001",
      "kind": "look",
      "ask": "Do the 375 px shots of the sunrise look right?",
      "options": [
        "Yes",
        "Hold",
        "No"
      ],
      "recommended": "Yes",
      "why": "The tests and the review are green.",
      "answer": null,
      "note": null,
      "at": "2030-01-07T10:00:00Z",
      "answeredAt": null,
      "via": null
    },
    "goal": "Example: show a sunrise colour in the sky of the demo scene",
    "stream": "DEMO",
    "ageH": 0.2
  }
}
